{
  "schemaVersion": "1.0",
  "title": "Infrastructure learning sample",
  "description": "Four required units and one optional exercise.",
  "language": "en",
  "nodes": [
    {
      "id": "fundamentals",
      "kind": "stage",
      "parentId": null,
      "order": 0,
      "title": "Infrastructure fundamentals",
      "body": "# Infrastructure fundamentals\n\nWork in an isolated lab.\n",
      "estimatedMinutes": null,
      "difficulty": null,
      "tags": [],
      "completion": null,
      "resourceUrl": null
    },
    {
      "id": "networking",
      "kind": "module",
      "parentId": "fundamentals",
      "order": 0,
      "title": "Networking",
      "body": "# Networking\n\nUnderstand addressing and diagnostics.\n",
      "estimatedMinutes": null,
      "difficulty": null,
      "tags": [],
      "completion": null,
      "resourceUrl": null
    },
    {
      "id": "ip-basics",
      "kind": "lesson",
      "parentId": "networking",
      "order": 0,
      "title": "Addressing and diagnostics",
      "body": "# Addressing and diagnostics\n\nRead the tasks below. Reading alone does not complete this lesson.\n",
      "estimatedMinutes": null,
      "difficulty": null,
      "tags": [],
      "completion": null,
      "resourceUrl": null
    },
    {
      "id": "inspect-config",
      "kind": "task",
      "parentId": "ip-basics",
      "order": 0,
      "title": "Inspect configuration",
      "body": "# Inspect configuration\n\nRecord your lab IP address and explain the subnet mask.\n",
      "estimatedMinutes": null,
      "difficulty": null,
      "tags": [],
      "completion": {
        "required": true,
        "rule": "self"
      },
      "resourceUrl": null
    },
    {
      "id": "test-connectivity",
      "kind": "task",
      "parentId": "ip-basics",
      "order": 1,
      "title": "Test connectivity",
      "body": "# Test connectivity\n\nTest connectivity inside the lab and record the result.\n",
      "estimatedMinutes": null,
      "difficulty": null,
      "tags": [],
      "completion": {
        "required": true,
        "rule": "self"
      },
      "resourceUrl": null
    },
    {
      "id": "packet-exercise",
      "kind": "exercise",
      "parentId": "ip-basics",
      "order": 2,
      "title": "Optional packet exercise",
      "body": "# Optional packet exercise\n\nAnalyze a synthetic packet capture.\n",
      "estimatedMinutes": null,
      "difficulty": null,
      "tags": [],
      "completion": {
        "required": false,
        "rule": "self"
      },
      "resourceUrl": null
    },
    {
      "id": "work-safety",
      "kind": "lesson",
      "parentId": "fundamentals",
      "order": 1,
      "title": "Lab safety and documentation",
      "body": "# Lab safety and documentation\n\nUse synthetic accounts, isolated resources and clear notes. Confirm after reading.\n",
      "estimatedMinutes": null,
      "difficulty": null,
      "tags": [],
      "completion": {
        "required": true,
        "rule": "self"
      },
      "resourceUrl": null
    },
    {
      "id": "network-lab",
      "kind": "project",
      "parentId": "fundamentals",
      "order": 2,
      "title": "Small network lab",
      "body": "# Small network lab\n\nSubmit a diagram and connectivity evidence. An authorized reviewer approves this project in organization mode.\n",
      "estimatedMinutes": null,
      "difficulty": null,
      "tags": [],
      "completion": {
        "required": true,
        "rule": "approval"
      },
      "resourceUrl": null
    }
  ]
}
